{
  "pair_id": "retail_inv_sales_spy",
  "schema_version": "1.1.0",
  "indicator_nature": "coincident",
  "indicator_type": "production",
  "strategy_objective": "countercyclical_protection",
  "owner_writes": {
    "dana": [
      "indicator_nature",
      "indicator_type",
      "known_stress_episodes",
      "data_provenance"
    ],
    "evan": [
      "observed_direction",
      "direction_consistent",
      "key_finding",
      "confidence"
    ],
    "ray": [
      "strategy_objective",
      "narrative_summary",
      "expected_direction",
      "mechanism",
      "caveats"
    ]
  },
  "last_updated_by": "ray",
  "last_updated_at": "2026-10-16T18:27:53.094449+00:00",
  "indicator": "invsales",
  "target": "spy",
  "expected_direction": "countercyclical",
  "observed_direction": "procyclical",
  "direction_consistent": false,
  "mechanism": "The retail inventories-to-sales ratio rises when inventories accumulate faster than sales \u2014 a sign of weakening demand that typically precedes production cuts and equity weakness. A low/falling ratio signals healthy demand. The strategy reduces equity exposure when the ratio is high.",
  "confidence": "low",
  "key_finding": "Best search-phase rule uses level from 6 months earlier with OOS Sharpe 0.73 versus buy-and-hold 0.91.",
  "caveats": [
    "Winner is search-selected on a single monthly sample and needs holdout validation.",
    "Level thresholds are rolling-percentile based; regime pivots can drift across decades.",
    "Lead estimates rest on a limited number of cycles in the sample."
  ],
  "narrative_summary": "Retail inventories-to-sales ratio is tested as a countercyclical demand-stress overlay for SPY \u2014 reduce exposure when the ratio is high.",
  "known_stress_episodes": [
    {
      "label": "Dot-Com recession",
      "start": "2001-03-01",
      "end": "2001-11-30",
      "note": "NBER recession."
    },
    {
      "label": "Global Financial Crisis",
      "start": "2007-12-01",
      "end": "2009-06-30",
      "note": "NBER recession."
    },
    {
      "label": "COVID shock",
      "start": "2020-02-01",
      "end": "2020-04-30",
      "note": "NBER recession."
    },
    {
      "label": "2022 drawdown",
      "start": "2022-01-01",
      "end": "2022-12-31",
      "note": "Rate-hike bear market."
    }
  ],
  "data_provenance": {
    "source": "Data Master.xlsx (Census)",
    "series_id": "RETAILIRSA",
    "accessed_at": "2026-10-16T18:27:53.094449+00:00"
  }
}
