{
  "pair_id": "unrate_spy",
  "schema_version": "1.1.0",
  "indicator_nature": "lagging",
  "indicator_type": "macro",
  "strategy_objective": "countercyclical_protection",
  "owner_writes": {
    "dana": [
      "indicator_nature",
      "indicator_type",
      "known_stress_episodes",
      "data_provenance"
    ],
    "evan": [
      "observed_direction",
      "direction_consistent",
      "key_finding",
      "confidence"
    ],
    "ray": [
      "strategy_objective",
      "narrative_summary",
      "expected_direction",
      "mechanism",
      "caveats"
    ]
  },
  "last_updated_by": "ray",
  "last_updated_at": "2026-10-17T16:22:26.758989+00:00",
  "indicator": "unrate",
  "target": "spy",
  "expected_direction": "countercyclical",
  "observed_direction": "countercyclical",
  "direction_consistent": true,
  "mechanism": "A rising unemployment rate usually reflects a weakening labor market and recession risk; equity exposure should be reduced when labor stress is elevated.",
  "confidence": "low",
  "key_finding": "As known at the time (real-time UNRATE vintages), the rule selected on in-sample data uses sahm at L5 (IS Sharpe 1.06) with held-out OOS Sharpe 0.43 versus buy-and-hold 1.00.",
  "caveats": [
    "UNRATE is usually lagging, so it may confirm recessions after equities have already moved.",
    "The strategy is search-selected and needs fresh holdout validation.",
    "Monthly labor data is revised and released with a delay; the headline uses the values as published at each date (ALFRED vintages), and the as-revised-today result is shown only for comparison."
  ],
  "narrative_summary": "UNRATE is tested as a defensive labor-market stress overlay for SPY, not as a clean leading indicator.",
  "known_stress_episodes": [
    {
      "label": "Dot-Com recession",
      "start": "2001-03-01",
      "end": "2001-11-30",
      "note": "Unemployment rose after the equity peak."
    },
    {
      "label": "Global Financial Crisis",
      "start": "2007-12-01",
      "end": "2009-06-30",
      "note": "UNRATE and Sahm-style signals rose sharply."
    },
    {
      "label": "COVID shock",
      "start": "2020-02-01",
      "end": "2020-04-30",
      "note": "Unemployment spiked rapidly."
    }
  ],
  "data_provenance": {
    "source": "FRED",
    "series_id": "UNRATE",
    "accessed_at": "2026-10-17T16:22:26.758989+00:00"
  }
}
