{
  "pair_id": "eci_total_comp_spy",
  "schema_version": "1.1.0",
  "indicator": "eci_total_comp",
  "target": "spy",
  "indicator_nature": "lagging",
  "indicator_type": "macro",
  "strategy_objective": "max_sharpe",
  "expected_direction": "countercyclical",
  "data_provenance": {
    "source": "FRED (BLS \u2014 Employment Cost Index: Total compensation: All Civilian, SA)",
    "series_id": "ECIALLCIV",
    "accessed_at": "2026-07-06T12:43:48Z"
  },
  "known_stress_episodes": [
    {
      "label": "GFC wage deceleration",
      "start": "2008-09-30",
      "end": "2010-12-31",
      "note": "Total-compensation growth decelerated sharply after the GFC as labor markets slackened; YoY fell toward ~1.4%."
    },
    {
      "label": "2021-23 wage-inflation surge",
      "start": "2021-06-30",
      "end": "2023-12-31",
      "note": "Post-COVID labor shortage drove ECI YoY to ~5.1% (mid-2022) \u2014 the key wage-price-spiral scare feeding Fed tightening; real, not a data error."
    }
  ],
  "related_pair_ids": [
    "m2sl_yoy_spy",
    "indpro_spy"
  ],
  "owner_writes": {
    "dana": [
      "pair_id",
      "schema_version",
      "indicator",
      "target",
      "indicator_nature",
      "indicator_type",
      "data_provenance",
      "known_stress_episodes",
      "related_pair_ids"
    ],
    "evan": [
      "observed_direction",
      "direction_consistent",
      "key_finding",
      "confidence"
    ],
    "ray": [
      "strategy_objective",
      "expected_direction",
      "mechanism",
      "caveats",
      "narrative_summary"
    ]
  },
  "last_updated_by": "evan",
  "last_updated_at": "2026-10-16T18:33:11Z",
  "observed_direction": "countercyclical",
  "direction_consistent": true,
  "key_finding": "Lead-lag verdict (empirical, QUARTERLY): ECI total compensation is 'lagging' vs SPY. Toda-Yamamoto Granger ECI->SPY significant lags(q) NONE; SPY->ECI significant lags(q) [1, 2, 3, 4]; pre-whitened CCF significant lead(+) lags NONE, lag(-) NONE. Tournament winner (hmm_stress/T3_zscore_1.0/P1_long_cash counter/L4q/LB12) is countercyclical: OOS Sharpe 1.41 vs B&H 0.80 (sqrt(4) annualization). SMALL-SAMPLE CANDIDATE: 25-QUARTER OOS -> found-in-search, not a validated edge; bootstrap p=0.184, durability 'conditionally_durable'. Winner's own lead-curve peaks at L4q (published L4q).",
  "confidence": "low"
}